{
  "schema_version": 2,
  "briefing_date": "2026-09-11",
  "headline": "Réforme du chômage : après l’arrêt, l’épreuve de l’application",
  "must_know": [
    {
      "rank": 1,
      "title": "La limitation du chômage est maintenue, mais son régime transitoire est partiellement annulé",
      "new_fact": "La presse et les organisations requérantes rapportent que la Cour constitutionnelle valide le principe de la limitation dans le temps, tout en jugeant discriminatoire une disposition transitoire. Les syndicats estiment qu’environ 100.000 personnes bénéficient d’un sursis.",
      "why_it_matters": "La réforme demeure, mais son calendrier concret doit être repris pour une partie importante des personnes situées dans les premières vagues d’exclusion.",
      "watch_today": "Le texte intégral de l’arrêt, la définition exacte des personnes concernées et les instructions que l’ONEM transmettra aux organismes de paiement.",
      "certainty": "rapporte",
      "sources": [
        {
          "title": "La Cour constitutionnelle valide la réforme du chômage, à l'exception d'une disposition",
          "publisher": "La Libre Belgique",
          "source_class": "news_media",
          "url": "https://www.lalibre.be/belgique/politique-belge/2026/09/10/la-cour-constitutionnelle-valide-la-reforme-du-chomage-a-lexception-dune-disposition-53QD4RS7LZDH3HYGMUKK4BYCY4/",
          "certainty": "rapporte"
        },
        {
          "title": "La Cour constitutionnelle annule partiellement les mesures transitoires de la réforme chômage",
          "publisher": "Ligue des droits humains",
          "source_class": "civil_society",
          "url": "https://www.liguedh.be/droits-sociaux/la-cour-constitutionnelle-annule-partiellement-les-mesures-transitoires-de-la-reforme-chomage-octroyant-un-sursis-a-environ-100-000-personnes/",
          "certainty": "declaration"
        }
      ]
    },
    {
      "rank": 2,
      "title": "Un accès direct au kinésithérapeute est annoncé pour certaines affections légères",
      "new_fact": "Selon la presse flamande, un projet d’arrêté royal doit permettre à partir de 2027 de consulter certains kinésithérapeutes sans prescription préalable pour des douleurs légères du cou ou du bas du dos, sous conditions encore à préciser.",
      "why_it_matters": "La mesure modifierait le parcours de soins, la fonction de filtre du médecin généraliste et potentiellement les conditions de remboursement.",
      "watch_today": "Le texte adopté par le Conseil des ministres, les affections couvertes, la qualification exigée des kinésithérapeutes et les règles de remboursement.",
      "certainty": "rapporte",
      "sources": [
        {
          "title": "Voortaan kun je naar de kinesist gaan zonder voorschrift van de dokter",
          "publisher": "Gazet van Antwerpen",
          "source_class": "news_media",
          "url": "https://www.gva.be/politiek/nekpijn-of-een-tenniselleboog-voortaan-kun-je-naar-de-kinesist-gaan-zonder-voorschrift-van-de-dokter/161285980.html",
          "certainty": "rapporte"
        }
      ]
    },
    {
      "rank": 3,
      "title": "Le diesel atteint un nouveau prix maximum de 2,407 euros le litre",
      "new_fact": "Le prix maximum annoncé pour le diesel B7 augmente de 5,1 centimes et atteint 2,407 euros le litre.",
      "why_it_matters": "La hausse se répercute immédiatement sur les automobilistes et peut ensuite toucher les coûts de transport des entreprises et des marchandises.",
      "watch_today": "La durée du choc, l’écart entre prix maximum et prix pratiqués et la prochaine actualisation officielle du contrat-programme.",
      "certainty": "rapporte",
      "sources": [
        {
          "title": "Diesel : encore plus cher dès demain, le litre à 2,407 euros",
          "publisher": "RTBF Info",
          "source_class": "news_media",
          "url": "https://www.rtbf.be/article/diesel-encore-plus-cher-des-demain-le-litre-a-2-407-euros-11782915",
          "certainty": "rapporte"
        }
      ]
    },
    {
      "rank": 4,
      "title": "La hausse des nouveaux loyers wallons ralentit au premier semestre",
      "new_fact": "Le baromètre de Federia cité par L’Avenir chiffre à 1,7 % la progression des loyers wallons au premier semestre 2026.",
      "why_it_matters": "Un ralentissement du prix des nouveaux baux ne signifie pas nécessairement que le logement redevient accessible ni que tous les territoires suivent la même trajectoire.",
      "watch_today": "Le baromètre primaire, sa méthode, les différences par province et type de logement et la part des ménages réellement concernés par ces nouveaux contrats.",
      "certainty": "rapporte",
      "sources": [
        {
          "title": "Loyers en Wallonie : la hausse des prix se calme",
          "publisher": "L'Avenir",
          "source_class": "news_media",
          "url": "https://www.lavenir.net/actu/2026/09/11/loyers-en-wallonie-la-hausse-des-prix-se-calme-mais-le-repit-pourrait-etre-de-courte-duree-3C3IX2A7P5H5JC7NPYJ7XJYFGU/",
          "certainty": "rapporte"
        }
      ]
    },
    {
      "rank": 5,
      "title": "Bruxelles maintient le code jaune face à la sécheresse",
      "new_fact": "La cellule régionale sécheresse a décidé de maintenir la phase de vigilance jaune, selon la VRT.",
      "why_it_matters": "Le maintien de la vigilance après l’été permet de vérifier si la sécheresse devient une contrainte durable pour l’eau, les sols et les espaces verts urbains.",
      "watch_today": "Les indicateurs régionaux ayant motivé la décision, les éventuelles restrictions et l’état comparé des nappes, cours d’eau et sols.",
      "certainty": "rapporte",
      "sources": [
        {
          "title": "Brussel houdt code geel aan voor droogte",
          "publisher": "VRT NWS",
          "source_class": "news_media",
          "url": "https://vrtnws.be/p.6KV7PVXLe",
          "certainty": "rapporte"
        }
      ]
    }
  ],
  "original_pitches": [
    {
      "title": "Les 100.000 courriers qu’il faut peut-être réécrire",
      "pitch": "On pourrait raconter l’arrêt sur le chômage depuis la chaîne administrative qui doit maintenant identifier les personnes repêchées, corriger leur dossier et leur expliquer leurs nouveaux droits.",
      "central_question": "Qui doit réparer quoi, dans quel ordre, pour que l’annulation partielle ne reste pas une victoire seulement juridique ?",
      "angle_engine": "system_backstage",
      "fresh_signal": "L’annulation d’une disposition transitoire est rapportée comme pouvant concerner environ 100.000 personnes.",
      "dominant_coverage": "Le traitement dominant oppose victoire du gouvernement et victoire partielle des syndicats.",
      "original_move": "Quitter le duel politique et suivre un dossier concret entre Cour constitutionnelle, ONEM, organisme de paiement, CPAS et personne déjà avertie d’une exclusion.",
      "factual_basis": [
        "Le principe de la limitation dans le temps est rapporté comme maintenu.",
        "Une disposition transitoire est rapportée comme discriminatoire et annulée.",
        "Le chiffre d’environ 100.000 personnes provient à ce stade des organisations requérantes."
      ],
      "checks_needed": [
        "Lire l’arrêt et isoler précisément la catégorie discriminée.",
        "Obtenir le nombre de dossiers déjà notifiés dans cette catégorie.",
        "Demander qui suspend, corrige et réexpédie les décisions individuelles."
      ],
      "field_or_incarnation": "Une personne ayant déjà reçu un avertissement d’exclusion et son organisme de paiement, avec documents anonymisés.",
      "tv_hook": "Le trajet matériel d’un même dossier et les courriers avant/après l’arrêt.",
      "radio_hook": "Le récit chronologique d’une personne qui ne sait plus quelle date vaut, confronté à l’explication de l’ONEM.",
      "people_to_explore": [],
      "verdict": "un_appel_necessaire",
      "risk_flags": [
        "chiffre de 100.000 provenant des requérants",
        "arrêt primaire absent du paquet"
      ],
      "sources": [
        {
          "title": "La Cour constitutionnelle annule partiellement les mesures transitoires de la réforme chômage",
          "publisher": "Ligue des droits humains",
          "source_class": "civil_society",
          "url": "https://www.liguedh.be/droits-sociaux/la-cour-constitutionnelle-annule-partiellement-les-mesures-transitoires-de-la-reforme-chomage-octroyant-un-sursis-a-environ-100-000-personnes/",
          "certainty": "declaration"
        },
        {
          "title": "La Cour constitutionnelle valide la réforme du chômage, à l'exception d'une disposition",
          "publisher": "La Libre Belgique",
          "source_class": "news_media",
          "url": "https://www.lalibre.be/belgique/politique-belge/2026/09/10/la-cour-constitutionnelle-valide-la-reforme-du-chomage-a-lexception-dune-disposition-53QD4RS7LZDH3HYGMUKK4BYCY4/",
          "certainty": "rapporte"
        }
      ]
    },
    {
      "title": "Des radars financés sans pouvoir mesurer leur effet",
      "pitch": "On pourrait raconter la politique wallonne contre la vitesse à partir d’un paradoxe : la Région finance des radars mais ne disposerait pas des informations nécessaires pour savoir ce qu’ils changent réellement.",
      "central_question": "Qui possède les données permettant de relier l’emplacement des radars, les infractions, les vitesses et les accidents ?",
      "angle_engine": "promise_test",
      "fresh_signal": "L’Avenir rapporte qu’un audit de la Cour des comptes critique l’absence de stratégie globale et de moyens d’évaluation.",
      "dominant_coverage": "Le traitement immédiat résume le mauvais bulletin adressé à la politique de sécurité routière.",
      "original_move": "Reconstituer la circulation des données entre Région, police, justice et communes sur deux radars comparables.",
      "factual_basis": [
        "La Région vise zéro tué sur les routes en 2050.",